tweet,date,city,user_location,id,link
"El Bruno ya preparado para navidad. Este es el Bruno navideño de la buena suerte, deja tu ❤️ y tendrás buena suerte JAJAJAJAJAA 🤪🤪🤪🤪 https://t.co/V5vR00Utjl",2020-11-20 05:10:54,Bogotá,"Chía, Colombia",1329653422124134400,https://twitter.com/i/web/status/1329653422124134400
¿Ya armaron el arbolito de navidad 🎄?.,2020-11-20 05:07:46,Bogotá,"𝙱𝚘𝚐𝚘𝚝á, 𝙲𝚘𝚕𝚘𝚖𝚋𝚒𝚊",1329652633536241664,https://twitter.com/i/web/status/1329652633536241664
Cómo sera pasar una navidad con pareja? Xd,2020-11-20 04:47:05,Bogotá,"Bogotá, Colombia",1329647429831028749,https://twitter.com/i/web/status/1329647429831028749
"Ya lo vieron más de 150 personas, que van a querer de navidad fans",2020-11-20 04:47:01,Bogotá,Bogotá,1329647410772111361,https://twitter.com/i/web/status/1329647410772111361
"En mi carta de navidad para papá Noel, le voy a pedir que me traiga de regalo a alguien que me quiera y me valore de verdad:(",2020-11-20 04:44:10,Bogotá,"Bogotá, Colombia",1329646694926004224,https://twitter.com/i/web/status/1329646694926004224
Nada más doloroso que perder a tu madre a pocos días de navidad.,2020-11-20 04:43:21,Bogotá,"Villavicencio, Colombia",1329646489304518656,https://twitter.com/i/web/status/1329646489304518656
Faltan 38 días para navidad y estoy entre colgar las luces o colgarme yo.,2020-11-20 04:40:39,Bogotá,Bogota- Colombia,1329645811945402375,https://twitter.com/i/web/status/1329645811945402375
A mi SI se me adelantó la navidad: la dicha de pasar semanas con mi madre 🥰 https://t.co/Jq9DMMDyJ3,2020-11-20 04:29:15,Bogotá,Bogotá,1329642941321768960,https://twitter.com/i/web/status/1329642941321768960
"Lo mejor de esta época, es sentarse con todo apagado, prender la navidad , y reflexionar . https://t.co/GxFqguZNa0",2020-11-20 04:23:48,Bogotá,Ibague,1329641571038466048,https://twitter.com/i/web/status/1329641571038466048
De navidad quiero muchos libros🥰💕,2020-11-20 04:11:30,Bogotá,"Bogotá, Colombia.",1329638476178976770,https://twitter.com/i/web/status/1329638476178976770
"@MillosFCoficial y sus fracasos constantes, se les volvió normal fracasar, Serpa y Camacho felices de la pelota van a tener una navidad feliz como siempre, y nosotros los hinchas comiendo mierda como de costumbre... LPM",2020-11-20 03:52:17,Bogotá,Bogotá,1329633637394915328,https://twitter.com/i/web/status/1329633637394915328
Otra navidad más sin ir a novenas :v.,2020-11-20 03:45:01,Bogotá,Bogota,1329631810091954177,https://twitter.com/i/web/status/1329631810091954177
Yo esperando a que llegue la navidad luego de haber creído durante tantos años que tú me eras fiel jajaja 🤣#MentirasDeTuiterosParaCuliar,2020-11-20 03:44:42,Bogotá,"Cundinamarca, Colombia",1329631729959768064,https://twitter.com/i/web/status/1329631729959768064
En mi casa también empezando a estar modo: navidad. 🎄🎄🎄 https://t.co/3BHxWpyEct,2020-11-20 03:40:41,Bogotá,Pereira,1329630718406881287,https://twitter.com/i/web/status/1329630718406881287
"La gente muriendo de hambre como consecuencia de la pandemia y las alcaldías iluminando la navidad... coman mierda, coherencia hijueputas.",2020-11-20 03:33:32,Bogotá,"Bogotá, Colombia",1329628921466417154,https://twitter.com/i/web/status/1329628921466417154
"@QuinteroCalle Salido totalmente de contexto alcalde Quintero. Solo hay una razón por la que se llama navidad (nacimiento), y nada tiene que ver el diablo en ella. Respete! 👎🏻",2020-11-20 03:33:28,Bogotá,pereira colombia,1329628904345235456,https://twitter.com/i/web/status/1329628904345235456
quién me regala el evaluame de navidad jajs,2020-11-20 03:32:26,Bogotá,Bogotá - Colombia,1329628641693667328,https://twitter.com/i/web/status/1329628641693667328
@fernanda_2344 Con el tiempo uno solo vuelve a pasar navidad y año nuevo y media vuelta.,2020-11-20 03:27:45,Bogotá,Bogotá,1329627465627688962,https://twitter.com/i/web/status/1329627465627688962
"@DanielSamperO @MegustaleerCo @Escuelade_YT Yo me voy a poner a bailar, ese ritmo está buenísimo. Se me pegó 🎉🎉😅 Ideal para esta navidad. #ConPDePolombia",2020-11-20 03:23:58,Bogotá,"Pereira, Colombia",1329626511494754304,https://twitter.com/i/web/status/1329626511494754304
"#artemilama
Pedidos al internó en preciosos adornos de navidad. https://t.co/WrI0ZiAolk",2020-11-20 03:16:18,Bogotá,Soacha/Cundinamarca,1329624584757370885,https://twitter.com/i/web/status/1329624584757370885
y este vestido que les queda apenas pa navidad https://t.co/KuXW0mhxyd,2020-11-20 03:14:34,Bogotá,Bogotá,1329624147002077184,https://twitter.com/i/web/status/1329624147002077184
"Promociones y más promociones en Deportenis 👌
https://t.co/taAF4X4eHd",2020-11-20 03:00:01,Bogotá,"Bogotá, Colombia",1329620485710041088,https://twitter.com/i/web/status/1329620485710041088
"Existen dos tipos de personas, los que ponen las decoraciones de navidad desde el 1 de noviembre y los que esperan hasta el 7 de velitas para inagurar navidad.",2020-11-20 02:58:31,Bogotá,Bogotá-Colombia.,1329620107346268161,https://twitter.com/i/web/status/1329620107346268161
"Señor Eliser, ¿Usted toma? / Solo una copita de Jérez en Navidad https://t.co/dl3TSFvWDi",2020-11-20 02:55:43,Bogotá,Bogotá,1329619401621049348,https://twitter.com/i/web/status/1329619401621049348
"Llega navidad 🤶🦌🦌🤶🛷🛷🛷 #maxitriana en Mosquera, Cundinamarca https://t.co/r4afmw1Sja",2020-11-20 02:52:03,Bogotá,"bogota, Colombia",1329618481596264454,https://twitter.com/i/web/status/1329618481596264454
Ya sé qué me voy a regalar de navidad. https://t.co/uEqG2L1d8H,2020-11-20 02:44:53,Bogotá,"Zipaquirá, Colombia",1329616674769735680,https://twitter.com/i/web/status/1329616674769735680
"voy a poner a jah con el gorrito de navidad el 1 de diciembre, mientras tanto voy a disfrutar de rocky pequeñito jsjksksjs",2020-11-20 02:38:58,Bogotá,bogotá,1329615189747101702,https://twitter.com/i/web/status/1329615189747101702
de navidad solo pido unos audífonos buenos @niñodios,2020-11-20 02:22:31,Bogotá,Bogotá - Colombia,1329611049616728069,https://twitter.com/i/web/status/1329611049616728069
Ricky Martin es todo lo que quiero para Navidad.,2020-11-20 02:21:26,Bogotá,Bogotá ,1329610776458432514,https://twitter.com/i/web/status/1329610776458432514
"Si yo le gusto dígame, quien quita y usted también me guste y pasemos navidad juntos...",2020-11-20 02:17:02,Bogotá,Villavicencio-Meta,1329609669376151553,https://twitter.com/i/web/status/1329609669376151553
Ya saben que me pueden dar de navidad https://t.co/lnarACIq5y,2020-11-20 02:15:29,Bogotá,"Manizales, Colombia",1329609279012270083,https://twitter.com/i/web/status/1329609279012270083
"Mi hermano de navidad quiere un dron de 5 palos, k te pasa Gonorrea",2020-11-20 02:03:22,Bogotá,Bogota,1329606227597422592,https://twitter.com/i/web/status/1329606227597422592
"Esta navidad será diferente, pero finalmente estaremos con los que siempre han sido, siempre han estado, en las buenas y en LAS MALAS.",2020-11-20 02:03:07,Bogotá,"Manizales, Caldas, Colombia",1329606164276011010,https://twitter.com/i/web/status/1329606164276011010
"¡""De año nuevo y navidad""!
19 de noviembre.
Estoy con deseo de terminar.
Pero no estoy preparado para navidad.
Y tengo que estar agradecido.",2020-11-20 02:00:41,Bogotá,"Manizales, Colombia",1329605552519983104,https://twitter.com/i/web/status/1329605552519983104
Pues yo digo que tiene ma que ver con la navidad el diablo que los renos y los pingüinos. Pero bueno es mi opinión,2020-11-20 01:59:23,Bogotá,"Bogotá, D.C., Colombia",1329605226962284545,https://twitter.com/i/web/status/1329605226962284545
"@QuinteroCalle La navidad no es un carnacal ni una fiesta folklorica, es una fiesta con un  sentido religioso muy claro.  Ese diablito lo pueden guardar para jalogüín.",2020-11-20 01:57:16,Bogotá,"Ibagué, Colombia",1329604692867944454,https://twitter.com/i/web/status/1329604692867944454
Tan solo soy una persona que ya quiere que le paguen la prima de navidad 🥺,2020-11-20 01:52:28,Bogotá,Bogotá,1329603484266737671,https://twitter.com/i/web/status/1329603484266737671
@JuMaJaRa Jajajajajaja un bobo hp que no sabe como empezó la navidad jajaja pobre Diosito y estos fanáticos locos,2020-11-20 01:47:52,Bogotá,zipaquira ,1329602326630453249,https://twitter.com/i/web/status/1329602326630453249
Fav si quieres que sea tu regalito de Navidad,2020-11-20 01:47:50,Bogotá,,1329602319227482113,https://twitter.com/i/web/status/1329602319227482113
"@JuMaJaRa Jajajajjaja se nota que este bobo hp no sabe cómo empezo la navidad, la cual no es solo cristiana jajaja llorón de mierda",2020-11-20 01:44:53,Bogotá,zipaquira ,1329601578538590208,https://twitter.com/i/web/status/1329601578538590208
"@QuinteroCalle Son los más hermosos de COLOMBIA, la navidad es mágica y divina gracias a los alumbrados en Medellín, Señor Alcalde queremos verlos todos!!",2020-11-20 01:43:07,Bogotá,Bogota,1329601133711646720,https://twitter.com/i/web/status/1329601133711646720
"@ghitis @jbagbam74 El despilfarro de recursos en estos tiempos, realmente es una canallada y el de Medellín haciendo demonios gigantes disque para adornar la navidad. No se sabe cuál es peor.",2020-11-20 01:39:10,Bogotá,"Bogota, Colombia",1329600138936000520,https://twitter.com/i/web/status/1329600138936000520
@miniminibwl NAVIDAD AGUILA ROJAAAAA,2020-11-20 01:36:33,Bogotá,Bogota,1329599481789227008,https://twitter.com/i/web/status/1329599481789227008
"Me da igual la navidad, pero si mis papás quieren decorar, los apoyo.
No se porque tenemos que amargarnos solo porque no ha sido un buen año. Gracias Dios por tenerlos con vida.💫",2020-11-20 01:36:19,Bogotá,"Ibagué, Colombia",1329599421131132929,https://twitter.com/i/web/status/1329599421131132929
Tengo ganas de pasar navidad en una fondita paisa y no se que hacer la verdad.,2020-11-20 01:31:58,Bogotá,"Bogotá, Colombia",1329598324857593858,https://twitter.com/i/web/status/1329598324857593858
"La economía en el municipio de Soacha ya se ha reactivado en un 95%, sólo falta por reactivarse bares y discotecas. El alcalde @juancsaldarriag, asegura que toda la ciudad estará iluminada en navidad para reactivar el turismo. @Alcaldia_Soacha https://t.co/HkzivlFaU6",2020-11-20 01:31:53,Bogotá,Bogotá,1329598307606425601,https://twitter.com/i/web/status/1329598307606425601
Quiero un saco de Mickey de navidad😭,2020-11-20 01:29:55,Bogotá,"Bogotá, Colombia",1329597812468801536,https://twitter.com/i/web/status/1329597812468801536
Que pidieron para esta navidad?? 💋💥💋 https://t.co/gbDOseqCTy,2020-11-20 01:26:10,Bogotá,"Bogotá, D.C., Colombia",1329596866112212994,https://twitter.com/i/web/status/1329596866112212994
Lo más interesante de armar navidad es escuchar a mi abuela contando la historia de cada muñeco,2020-11-20 01:22:57,Bogotá,Bogota,1329596057739735041,https://twitter.com/i/web/status/1329596057739735041
"Quienes aprovechen la Navidad 🎄 en Deportenis, gozarán de envíos gratis por compras superiores a $300.000 😜
https://t.co/taAF4X4eHd",2020-11-20 01:20:00,Bogotá,"Bogotá, Colombia",1329595314248925185,https://twitter.com/i/web/status/1329595314248925185
No veo la gravedad de hacer una Navidad en Medellín con homenaje a las fiestas nacionales; una de estas es la de un diablo ¿qué tan terrible?,2020-11-20 01:16:33,Bogotá,Bogotá Colombia,1329594446728589312,https://twitter.com/i/web/status/1329594446728589312
"La Honesta presidenciable @ClaudiaLopez 🙄🐀
1) No entiendo el Objeto Contractual
2) ¿La navidad dura hasta Marzo?
La que habla de honestidad y es una payasa, la misma q no deja entrar a los Paperos pero si permite marchas y mierderos https://t.co/3GpsaZuBXn",2020-11-20 01:09:36,Bogotá,Bogota,1329592697640935424,https://twitter.com/i/web/status/1329592697640935424
Quiero galletas de navidad 🥺,2020-11-20 01:05:51,Bogotá,"Villavicencio, Colombia",1329591755638005760,https://twitter.com/i/web/status/1329591755638005760
"@EmelynJaimes Quizas para Navidad que haya Re-Stock. En Colombia tambien es misión imposible, y pagar por el más de los 500 USD que cuesta es muy mal negocio.",2020-11-20 00:57:23,Bogotá,Bogotá - Colombia,1329589624419856392,https://twitter.com/i/web/status/1329589624419856392
"Concurso de navidad «Un regalo para Villavo, un regalo para mi barrio» recorrerá la ciudad
https://t.co/YaFdpsIvUV https://t.co/WYYeHBsatm",2020-11-20 00:55:47,Bogotá,"Villavicencio, Colombia",1329589221586333696,https://twitter.com/i/web/status/1329589221586333696
La magia de la navidad llega a Mi Casa. Mañana 20 de noviembre nos llenamos de luz para recibir con gran alegría estas fiestas. Visítanos y disfrutemos juntos del encendido navideño. 🌟 https://t.co/2e7be7OCTg,2020-11-20 00:53:07,Bogotá,Bogotá,1329588549017100288,https://twitter.com/i/web/status/1329588549017100288
"Uds se imaginan que su novia les llegue con un ps5 para navidad, solo imaginen por que eso nunca sucederá, ni con el viento de la rosa de Guadalupe",2020-11-20 00:43:29,Bogotá,lerida tolima,1329586125594357760,https://twitter.com/i/web/status/1329586125594357760
"¡Aun no llega navidad y nosotros ya estamos así! ⏬
¿Ustedes también? Respóndenos con un Gif 
.
.
.
#EstafadorasDeWallStreet #Hustlers #Cine #Movie https://t.co/qsr3OkVhtF",2020-11-20 00:31:11,Bogotá,Bogotá Colombia,1329583030651019270,https://twitter.com/i/web/status/1329583030651019270
"P&amp;M habló con Ted Ketterer, director de mercadeo en The Coca Cola Company Colombia, para ahondar sobre las fuentes de inspiración, el mensaje, la comunicación y todo el trabajo creativo detrás de cada una de las campañas de navidad de la marca: https://t.co/f4z6nNvf1C",2020-11-20 00:30:16,Bogotá,"Bogotá, Colombia",1329582797657346050,https://twitter.com/i/web/status/1329582797657346050
"""Wonder Woman 1984"" se verá en cines y HBO Max en Navidad https://t.co/uHsg2OoXgI",2020-11-20 00:29:01,Bogotá,"Bogotá, Colombia",1329582486137962496,https://twitter.com/i/web/status/1329582486137962496
Estoy entre colgar las luces de Navidad o colgarme yo🙂.,2020-11-20 00:23:54,Bogotá,"Soacha, Colombia",1329581196595122180,https://twitter.com/i/web/status/1329581196595122180
"‘UN REGALO PARA VILLAVO, UN REGALO PARA MI BARRIO’ EL CONCURSO DE NAVIDAD QUE RECORRERÁ LA CIUDAD https://t.co/nR6qyqxVpO",2020-11-20 00:19:19,Bogotá,villavicencio,1329580044252012545,https://twitter.com/i/web/status/1329580044252012545
"Los Paisas no podemos permitir que Quinteto y EMP, se burlen de nuestros alumbrados de navidad, utilizando figuras diabólicas, donde celebramos el nacimiento del niño Dios y que nos respete que no estamos en un carnaval. Nos sentimos indignados. #RevocatoriaDanielQuintero.",2020-11-20 00:19:05,Bogotá,"Risaralda, Colombia",1329579985141723136,https://twitter.com/i/web/status/1329579985141723136
¿Vamos a ver lucecitas de navidad y a tomar aromática ? 🥰,2020-11-20 00:14:07,Bogotá,Bogota,1329578734467354632,https://twitter.com/i/web/status/1329578734467354632
La Navidad sin #VanessaHudgens no sería igual 🎄❄️⛄️,2020-11-20 00:12:07,Bogotá,"Manizales, Caldas",1329578231528370178,https://twitter.com/i/web/status/1329578231528370178
@SZZ888 Pero es que apenas es noviembre y la magulla se come en navidad o me tengo que preocupar porque tampoco he comido 😥,2020-11-20 00:10:47,Bogotá,"Armenia, Colombia",1329577894910324739,https://twitter.com/i/web/status/1329577894910324739
quieres un novio chimba para navidad?? llega al dm,2020-11-20 00:06:01,Bogotá,"Ibagué, Colombia",1329576697470066690,https://twitter.com/i/web/status/1329576697470066690
"@sanchez_jaen Eso me parecía que, al congelar, iba a perder textura. Cogeré la más pequeña y congelare el asunto es que en Navidad no hay a la venta. Acá o aprovechas el momento o...",2020-11-20 00:04:52,Bogotá,"Bogotá, D.C., Colombia",1329576406045569029,https://twitter.com/i/web/status/1329576406045569029
"Ustedes no se imaginan la tristeza tan profunda que empiezo a sentir por las fechas que se avecinan.
Navidad si que da duro!",2020-11-20 00:04:45,Bogotá,"Pereira, Colombia",1329576378044387328,https://twitter.com/i/web/status/1329576378044387328
quieres una novia chimba para navidad?? llega al dm 🤪,2020-11-20 00:01:32,Bogotá,"Soacha, Colombia",1329575566887051265,https://twitter.com/i/web/status/1329575566887051265
Yo no le voy a poner luces de navidad a mi casa porque nada brilla mas que yo.,2020-11-19 23:59:35,Bogotá,Ibagué Papi,1329575077680205826,https://twitter.com/i/web/status/1329575077680205826
La Navidad llega al CC Fontanar llena de magia y cuidados para todos @colectivo_pr @ingridwobst @FontanarCC #cnnireport #Entretenimiento #cultura #fashionista #fashionblogger #Belleza #salud #F4F #f4follow #fashionable #chicas #Fashion #Trending #TBT #chic https://t.co/RFI5oXMval,2020-11-19 23:54:36,Bogotá,Bogotá-Colombia,1329573825026158594,https://twitter.com/i/web/status/1329573825026158594
@Palejaz Pues esta bien.. Navidad jajaja https://t.co/W46suA4kbv,2020-11-19 23:49:38,Bogotá,"Ibagué, Colombia",1329572574385360896,https://twitter.com/i/web/status/1329572574385360896
"Eslovenia donará el gran árbol de Navidad que se alzará en la Plaza de San Pedro. El árbol de 28 metros de altura, procede de la región eslovena de Kočevje.",2020-11-19 23:47:23,Bogotá,Bogotá,1329572009408335875,https://twitter.com/i/web/status/1329572009408335875
"🔥⚽🎅Zlatan Navidad ⚽🎅🔥

En Italia, se agotaron todas las unidades del PS5 tras su lanzamiento. Y aún así Zlatan Ibrahimovic se las arregló para conseguir y regalarles la consola a sus compañeros del Milan, que le agradecieron por Instagram. 

🔥⚽CRACK EN TODO⚽🔥 https://t.co/jRG7HRkoq8",2020-11-19 23:46:02,Bogotá,"Manizales, Colombia",1329571669283893249,https://twitter.com/i/web/status/1329571669283893249
"Me ha llegado este material de Alba.  ¿Los expertos podrían indicarme algún sistema de conservación que, ojalá, me permita lleguen (al menos en parte) a Navidad. Muchas gracias. https://t.co/oVLiuqCsoT",2020-11-19 23:39:35,Bogotá,"Bogotá, D.C., Colombia",1329570044427243528,https://twitter.com/i/web/status/1329570044427243528
"#tbt navidad blanca @theatronbogota con @bella.castiblanco 

#koralito #fernandokoral #tenazmarica #theatron #memories #flashback #dragqueen #producer #entertainer #igers #igerscolombia en THEATRON DE PELICULA https://t.co/Vix9S5lT9g",2020-11-19 23:31:13,Bogotá,De tu propia tierra soy.,1329567939721355266,https://twitter.com/i/web/status/1329567939721355266
@Pachovelez10 Fabuloso Pacho. Buen regalo de navidad.,2020-11-19 23:22:57,Bogotá,Ibague- Colombia,1329565858331549698,https://twitter.com/i/web/status/1329565858331549698
"#FUTBOLxSDM 📲⚽️
¡ZLATAN NOEL! 🎅🏻
Ibrahimovic se adelantó a la navidad y le regaló un #PS5 a todos los jugadores del Milán 🇮🇹 Etiqueta a tu amigo que te regala el Play 5 😅😅⬇️ https://t.co/BhGEw8AKux",2020-11-19 23:21:00,Bogotá,"Bogotá, Colombia",1329565367958695936,https://twitter.com/i/web/status/1329565367958695936
Dios os bendiga sigo ofreciendo mis artesanías con sentido social para tratamiento enfermedad huerfana neurodegenerativa. Al comprarmen me dan alegria en mi navidad y la de mi madre Whatsapp 3104937745 https://t.co/Eyzuy8bBPT,2020-11-19 23:20:44,Bogotá,"Pereira, Colombia",1329565300937863168,https://twitter.com/i/web/status/1329565300937863168
¡Celebra la navidad andando en bici! 🎄😍🚲‍ Registra tus facturas de compra de mínimo $20.000 y por cada $100.000 pesos acumulables podrás ganar una de las 20 Bicicletas todoterreno que estaremos entregando. 😉🚴🏻🚴🏾‍♀️ *Aplican términos y condiciones. #CentroChiaCC https://t.co/n6sW4FZjBW,2020-11-19 23:17:47,Bogotá,"Chía, Colombia",1329564559221403656,https://twitter.com/i/web/status/1329564559221403656
"@QuinteroCalle Exacto. Si supieran lo que significa cada abominación o ajora que llega diciembre por lo menos investigarán las 7 verdades sobre la Navidad, el enfoque se haría diferente en las fiestas.",2020-11-19 23:16:39,Bogotá,Bogotá - Colombia ,1329564274159722500,https://twitter.com/i/web/status/1329564274159722500
Se acerca la temporada de compras de Navidad y nuestro podcast #NotiSIC te ofrece recomendaciones para que seas un consumidor informado y responsable. Escucha este programa de la #SICSuper en https://t.co/8nuXAOVIiC https://t.co/gTNmOjqoep,2020-11-19 23:15:48,Bogotá,Bogotá-Colombia,1329564060594139136,https://twitter.com/i/web/status/1329564060594139136
"¿Buscando qué regalar de navidad🎄? Te lo tenemos 😱 ¡ Invita a tu familia y amigos este 2️⃣8️⃣ de noviembre a preparar una deliciosa milhoja 🤤 con el chef Alejandro Gutierrez de @salvopatria !
•
Inscríbete YA en https://t.co/vXkyNhTpFO y Únete 💪🏻 a #unamilhojaporlanutricion 💫 https://t.co/LQRraQ8mCd",2020-11-19 23:10:00,Bogotá,"Bogotá, Colombia",1329562598648524801,https://twitter.com/i/web/status/1329562598648524801
@GloriaMaria_T @nelsonpte123 @DEISYAL17 @QuinteroCalle Yo no le considero cristiana. Así que ni fu ni fa. Muchos no cristianos celebran navidad. ¿Les van a llamar paganos también? Ahora es una fecha dónde se rumbea.,2020-11-19 23:06:02,Bogotá,Bogotá,1329561603352784896,https://twitter.com/i/web/status/1329561603352784896
"Este año saco lo mejor de nosotros y en la #FamiliaClaro seguiremos conectando a millones de colombianos en la mejor época del año, por eso sonríe, dale la bienvenida a la Navidad y a la #MagiaYEsperanza ❄☃ conoce más aquí 👉 https://t.co/YCfXcHR3JM https://t.co/LcyIAacZWW",2020-11-19 23:04:45,Bogotá,Bogotá - Colombia,1329561280185651201,https://twitter.com/i/web/status/1329561280185651201
"Entonces el América eventualmente podría quedarse fuera de los ocho, y a las águilas llegarle su Navidad.,vea pues.",2020-11-19 22:55:55,Bogotá,Bogotá,1329559057473167365,https://twitter.com/i/web/status/1329559057473167365
"@Macb_05 @mario_tobo @QuinteroCalle Eso no es cuestión de darselas de culto o sabiondo es de preferencias y la navidad Colombiana es con Jesus y la virgen por muchos años de unión y de estar en familia de felicidad, no de Lucifer ni de diablitos sobados.",2020-11-19 22:55:49,Bogotá,Bogotá,1329559030088536064,https://twitter.com/i/web/status/1329559030088536064
@Una_mamerta_mas Como a maraca en navidad. 🤭,2020-11-19 22:43:28,Bogotá,BOGOTA,1329555923665350657,https://twitter.com/i/web/status/1329555923665350657
“Eterna Navidad: Celebremos” https://t.co/2ydk3o9ihY,2020-11-19 22:24:03,Bogotá,"Pereira, Colombia",1329551034478436353,https://twitter.com/i/web/status/1329551034478436353
"Nuestros amplios pasillos permiten que te sientas muy seguro mientras nos visitas, aprovecha este 21 de Noviembre para adelantar las #Compras de #navidad.

#DiaSinIva #Bogota #CentrosComerciales  #Descuentos #ParqueaderoGratis #BulevarNiza https://t.co/6yShtFm4WJ",2020-11-19 22:21:02,Bogotá,Bogotá ,1329550278274768901,https://twitter.com/i/web/status/1329550278274768901
"Piensa como adulto 🧏
Vive como Joven 🤸
Aconseja como anciano 🤶, y 
Sueña como niño 🦸

#dream #liveyourlife #thinking #navidad #boy en Centro Comercial Andino https://t.co/OnUKnLdN1h",2020-11-19 22:19:14,Bogotá,"Medellín, Colombia",1329549824568537091,https://twitter.com/i/web/status/1329549824568537091
Las cámaras de comercio del Tolima lideran campaña “Adelantamos la Navidad” https://t.co/6Za9Wn1C7Y,2020-11-19 22:17:19,Bogotá,"Ibagué, Tolima",1329549340868833280,https://twitter.com/i/web/status/1329549340868833280
"Teniendo en cuenta que mi hermano, mi cuñada y su familia y mi mamá ya saben de mi tema, Si acaso llego a pasar navidad con ellos ya no fingire más. Esta será la primera navidad en la que seré Yukio no importa qué.Allá mi mamá si se quiere amargar pero ya estoy grandecito e.e",2020-11-19 22:15:54,Bogotá,"Bogotá,Colombia",1329548984214491138,https://twitter.com/i/web/status/1329548984214491138
Necesito que alguien me regale el soundtrack de Peaky Blinders en vinilo de navidad. Gracias.,2020-11-19 22:12:19,Bogotá,Bogotá ,1329548082892185607,https://twitter.com/i/web/status/1329548082892185607
Te puedo pedir de navidad?,2020-11-19 22:05:07,Bogotá,"Bogotá, Colombia",1329546270936080391,https://twitter.com/i/web/status/1329546270936080391
"Además estoy comiendo bocha de salmón, atún, cerdo y no pago por una comida desde hace un mes, a menos que realmente se me antoje algo tipo pizza o pasta.
Todo sin lavar una copa. Un saludo a los kumpas que en navidad van a tener que reemplazar hasta el mantecol con polenta.",2020-11-19 22:01:46,Bogotá,Dinamarca,1329545427021148169,https://twitter.com/i/web/status/1329545427021148169
Un panite que me invite a armar un árbol de navidad puuuuesss,2020-11-19 21:58:40,Bogotá,"Pereira, Colombia",1329544647547478019,https://twitter.com/i/web/status/1329544647547478019
@JuMaJaRa Tweet del bienpensante diciendo que la Navidad es una celebración pagana y que los ateos también tienen derecho a celebrar como quieran https://t.co/gh764nxhJq,2020-11-19 21:56:00,Bogotá,"Ibague, colombia",1329543977700384774,https://twitter.com/i/web/status/1329543977700384774
"#Música - #NavidadEnFamilia"", la producción navideña de la banda peruana @caminodevida - https://t.co/xP62HqdZn8 https://t.co/pIeT0kHvDK",2020-11-19 21:52:08,Bogotá,Bogotá,1329543004353388544,https://twitter.com/i/web/status/1329543004353388544
Hoy como que todo el mundo armó la navidad o q,2020-11-20 05:11:56,Medellín,,1329653681906708485,https://twitter.com/i/web/status/1329653681906708485
