tweet,date,city,user_location,id,link
"En esta navidad celebra en casa. Usa el tapabocas, mantén el distanciamiento social, lávate las manos y disfruta de los platos navideños #ConFinoGustoNariñense 🤶 https://t.co/IdBJ8WXtIu",2020-11-19 15:15:35,Pasto,"Pasto, Colombia",1329443210461057028,https://twitter.com/i/web/status/1329443210461057028
"Yo dije que iba a ahorrar y ya me gasté mi sueldo en ropita para navidad 😳 no me juzguen, soy nueva en esto de tener dinero propio 😅",2020-11-18 21:27:27,Pasto,Pasto_Colombia ,1329174402660003844,https://twitter.com/i/web/status/1329174402660003844
"@carolinarcilar @QuinteroCalle @diamaov @LaHuellaton @Areametropol @AlcaldiadeMed señora, la navidad en si es una fiesta pagana.",2020-11-18 20:25:40,Pasto,"Pasto, Colombia",1329158856145055744,https://twitter.com/i/web/status/1329158856145055744
¿que son estas ganas locas de armar la navidad?,2020-11-18 18:58:06,Pasto,"Pasto, Colombia",1329136820479733764,https://twitter.com/i/web/status/1329136820479733764
@Fricca4 Jaajajajaja no se respeta la Navidad. https://t.co/EkfYxIis94,2020-11-18 15:11:40,Pasto,El desierto,1329079835453399040,https://twitter.com/i/web/status/1329079835453399040
@anamarqr Ahora la izquierda intenta acabar la Navidad y con todo.,2020-11-18 14:55:19,Pasto,"Pasto, Colombia",1329075722632105991,https://twitter.com/i/web/status/1329075722632105991
"Sacando los elfos y muñecos de nieve de navidad no pude evitar ver cierta malicia en sus ojos y cierta ironía en la comisura de sus labios, como si me dijeran “si ves que es feo estar encerrado todo un año”",2020-11-18 13:24:21,Pasto,Pasto - Colombia,1329052827835113472,https://twitter.com/i/web/status/1329052827835113472
Esta navidad pinta triste en mi casa 🥺,2020-11-18 03:55:56,Pasto,"Pasto, Colombia",1328909779390132225,https://twitter.com/i/web/status/1328909779390132225
esta 🖕🏽 pa los que arman navidad rápido,2020-11-17 23:25:39,Pasto,Aldea Oculta de la Hoja,1328841763574964225,https://twitter.com/i/web/status/1328841763574964225
"@julianadesade Entiendo que a los judíos no les gusta la navidad, lo de ellos es el hanuka no?",2020-11-17 12:09:03,Pasto,"Ipiales, Colombia",1328671488883494912,https://twitter.com/i/web/status/1328671488883494912
"@julianadesade @Daniel85662037 Descansamos, la navidad tiene orígenes paganos, hay q leer no?",2020-11-17 04:15:10,Pasto,Pasto Colombia,1328552235375194114,https://twitter.com/i/web/status/1328552235375194114
"Navidad, navidad...llego Navidad🥰🥰😘😘😘 https://t.co/OGkngpN6ol",2020-11-17 01:19:50,Pasto,"PASTO,NARIÑO",1328508110143508480,https://twitter.com/i/web/status/1328508110143508480
"@Koyvid19 @Waka92_ @SaintBelikin @Efidanz @AriHueCR @ClafoCR Si le entra , los está engordando para darles muero en Navidad xD",2020-11-16 18:49:43,Pasto,"Pasto, Colombia",1328409932509614082,https://twitter.com/i/web/status/1328409932509614082
"¿Soy la única que diciembre le vale kk y media? Es decir se volvió uno de los peores meses para mi, sorry si soy muy grinch but espero se acabe pronto navidad. 😐",2020-11-16 14:19:57,Pasto,"Pasto, Colombia",1328342045321273344,https://twitter.com/i/web/status/1328342045321273344
El niño ayudando a armar la navidad 🎄 https://t.co/tWB5klfC2N,2020-11-16 00:01:54,Pasto,"Pasto, Colombia",1328126109012078593,https://twitter.com/i/web/status/1328126109012078593
"Les cuento que volví a hacer TV, un formato infantil de navidad, el propósito es que los niños vivan su infancia, canten villancicos, disfruten las época, llevar una chispa de alegría en medio de lo duro de este año, en un formato apto para todos. https://t.co/9rcvSvhkDL",2020-11-15 19:54:53,Pasto,"Pasto, Colombia",1328063945391960067,https://twitter.com/i/web/status/1328063945391960067
"@NaviadronosPasto la mejor opción para una maravillosa Navidad. Cra 22 # 15-63 Antigua Calle Angosta, Calle 20 # 26-35 centro. La mejor Navidad es nuestro sello de garantía. https://t.co/hDLCXtsAGK",2020-11-15 13:35:52,Pasto,San  Juan de Pasto,1327968563798417408,https://twitter.com/i/web/status/1327968563798417408
"Mi novio me pidió que le ayude a arreglar la navidad, desde que hice un concurso de villancicos en la facu no sentía tanta responsabilidad sobre mi 😟",2020-11-15 05:46:12,Pasto,"Pasto, Colombia",1327850365883215872,https://twitter.com/i/web/status/1327850365883215872
Quiero a alguien para armar el arbolito de navidad,2020-11-15 04:02:48,Pasto,"Ipiales, Colombia",1327824347541729280,https://twitter.com/i/web/status/1327824347541729280
Amo la navidad.. pero soy como un imán para atraer escarcha (purpurina) a mis manos y cara... Ando brillando como un reflector... Creo que odio esa pequeña parte .....,2020-11-14 23:40:28,Pasto,Colombia,1327758325858127872,https://twitter.com/i/web/status/1327758325858127872
"Por orden presidencial, tras el último descubrimiento divino de jesuribe, la navidad se trasladará del 24 de diciembre al 4 de julio.",2020-11-14 19:40:22,Pasto,San Juan de Pasto,1327697904098828297,https://twitter.com/i/web/status/1327697904098828297
"Microhomofobia 😑😑😑 lo único que hace este tipo de post es generar mas homofobia, nadie te va a violentar porque te gusta la navidad. https://t.co/EKwz3CbQb6",2020-11-14 13:04:21,Pasto,Pasto ,1327598242821976065,https://twitter.com/i/web/status/1327598242821976065
@madorni ya se lo q quiero para navidad,2020-11-13 19:39:12,Pasto,Rio de la Plata,1327335223579856899,https://twitter.com/i/web/status/1327335223579856899
"@UnBesoYBang Vacaciones de Navidad, la de Chevy Chase.",2020-11-13 16:59:40,Pasto,San Juan de Pasto - Colombia,1327295073646768128,https://twitter.com/i/web/status/1327295073646768128
Feliz navidad por si no llego a diciembre,2020-11-13 01:39:59,Pasto,"Pasto, Colombia",1327063629963866112,https://twitter.com/i/web/status/1327063629963866112
"Ya quiero navidad año nuevo para reunirme  con mi familia con las personas que mas amo que llegue ese 2021 que este año para mi fue una mierda solo agradezco que todos mis seres queridos  están bien 
POR UN AÑO MEJOR PARA MI",2020-11-12 14:51:34,Pasto,"Ipiales, Colombia",1326900450965250049,https://twitter.com/i/web/status/1326900450965250049
"Ayudemos a Difundir esta bonita labor.
Que viva el Regalaton de Sonrisas 2020 que se dedican hacer felices a los niños de escasos recursos en esta Navidad en Mocoa y Putumayo. Participa de la actividad Donando un Juguete. 
 +573143163279 https://t.co/mvYyTG2BUo",2020-11-12 13:46:47,Pasto,Colombia 🇨🇴🌈,1326884148292816897,https://twitter.com/i/web/status/1326884148292816897
"En #SeñaldelaMañana le damos una mirada a la situación económica en la reactivación, de cara a la temporada de fin de año. Tu puedes participar contestando: ¿Cómo está tu bolsillo para Navidad?
📺 Conéctate desde las 6:00 a.m. en https://t.co/VgblzqUjaq https://t.co/I95SXxPNMI",2020-11-12 11:50:12,Pasto,"Nariño, Colombia",1326854807206899714,https://twitter.com/i/web/status/1326854807206899714
#SeñalDeLaMañana ¿Cómo está su bolsillo para Navidad? Es nuestro tema de hoy #HayPlataPara https://t.co/HKtABI6lfD,2020-11-12 11:36:05,Pasto,"Nariño, Colombia",1326851255969456128,https://twitter.com/i/web/status/1326851255969456128
"No sé si quiero botas, tocadiscos, vinilos o pantalones de navidad ptm 😭",2020-11-12 04:56:10,Pasto,Aldea Oculta de la Hoja,1326750614173462528,https://twitter.com/i/web/status/1326750614173462528
@MonseMeetsWorld Paty Navidad?,2020-11-12 02:16:04,Pasto,Aldea Oculta de la Hoja,1326710320648384515,https://twitter.com/i/web/status/1326710320648384515
Ya te pedí de navidad,2020-11-11 23:49:52,Pasto,Hatillo,1326673528339488768,https://twitter.com/i/web/status/1326673528339488768
@BabMahourian ¿Por lo de la banderita en la Navidad?,2020-11-11 15:29:46,Pasto,El desierto,1326547675852910595,https://twitter.com/i/web/status/1326547675852910595
"- Y te gusta la música de Navidad?
- Puesss...

Yo ya me estoy poniendo en #ModoDiciembre 😂🎅🏻 https://t.co/Ahlb5PwWHH",2020-11-11 14:29:32,Pasto,"Pasto, Colombia",1326532518221262850,https://twitter.com/i/web/status/1326532518221262850
"Lo mejor de esta época, es sentarse con todo apagado, prender la navidad , y reflexionar . https://t.co/GxFqguZNa0",2020-11-20 04:23:48,Manizales,Ibague,1329641571038466048,https://twitter.com/i/web/status/1329641571038466048
En mi casa también empezando a estar modo: navidad. 🎄🎄🎄 https://t.co/3BHxWpyEct,2020-11-20 03:40:41,Manizales,Pereira,1329630718406881287,https://twitter.com/i/web/status/1329630718406881287
Faltan como 35 días para navidad y estoy entre colgar las luces o colgarme yo,2020-11-20 03:36:26,Manizales,"La Dorada, Colombia",1329629650130264065,https://twitter.com/i/web/status/1329629650130264065
"@QuinteroCalle Salido totalmente de contexto alcalde Quintero. Solo hay una razón por la que se llama navidad (nacimiento), y nada tiene que ver el diablo en ella. Respete! 👎🏻",2020-11-20 03:33:28,Manizales,pereira colombia,1329628904345235456,https://twitter.com/i/web/status/1329628904345235456
"@DanielSamperO @MegustaleerCo @Escuelade_YT Yo me voy a poner a bailar, ese ritmo está buenísimo. Se me pegó 🎉🎉😅 Ideal para esta navidad. #ConPDePolombia",2020-11-20 03:23:58,Manizales,"Pereira, Colombia",1329626511494754304,https://twitter.com/i/web/status/1329626511494754304
Ya saben que me pueden dar de navidad https://t.co/lnarACIq5y,2020-11-20 02:15:29,Manizales,"Manizales, Colombia",1329609279012270083,https://twitter.com/i/web/status/1329609279012270083
"Esta navidad será diferente, pero finalmente estaremos con los que siempre han sido, siempre han estado, en las buenas y en LAS MALAS.",2020-11-20 02:03:07,Manizales,"Manizales, Caldas, Colombia",1329606164276011010,https://twitter.com/i/web/status/1329606164276011010
"¡""De año nuevo y navidad""!
19 de noviembre.
Estoy con deseo de terminar.
Pero no estoy preparado para navidad.
Y tengo que estar agradecido.",2020-11-20 02:00:41,Manizales,"Manizales, Colombia",1329605552519983104,https://twitter.com/i/web/status/1329605552519983104
"Uds se imaginan que su novia les llegue con un ps5 para navidad, solo imaginen por que eso nunca sucederá, ni con el viento de la rosa de Guadalupe",2020-11-20 00:43:29,Manizales,lerida tolima,1329586125594357760,https://twitter.com/i/web/status/1329586125594357760
"Los Paisas no podemos permitir que Quinteto y EMP, se burlen de nuestros alumbrados de navidad, utilizando figuras diabólicas, donde celebramos el nacimiento del niño Dios y que nos respete que no estamos en un carnaval. Nos sentimos indignados. #RevocatoriaDanielQuintero.",2020-11-20 00:19:05,Manizales,"Risaralda, Colombia",1329579985141723136,https://twitter.com/i/web/status/1329579985141723136
La Navidad sin #VanessaHudgens no sería igual 🎄❄️⛄️,2020-11-20 00:12:07,Manizales,"Manizales, Caldas",1329578231528370178,https://twitter.com/i/web/status/1329578231528370178
@SZZ888 Pero es que apenas es noviembre y la magulla se come en navidad o me tengo que preocupar porque tampoco he comido 😥,2020-11-20 00:10:47,Manizales,"Armenia, Colombia",1329577894910324739,https://twitter.com/i/web/status/1329577894910324739
"Ustedes no se imaginan la tristeza tan profunda que empiezo a sentir por las fechas que se avecinan.
Navidad si que da duro!",2020-11-20 00:04:45,Manizales,"Pereira, Colombia",1329576378044387328,https://twitter.com/i/web/status/1329576378044387328
Yo no le voy a poner luces de navidad a mi casa porque nada brilla mas que yo.,2020-11-19 23:59:35,Manizales,Ibagué Papi,1329575077680205826,https://twitter.com/i/web/status/1329575077680205826
"🔥⚽🎅Zlatan Navidad ⚽🎅🔥

En Italia, se agotaron todas las unidades del PS5 tras su lanzamiento. Y aún así Zlatan Ibrahimovic se las arregló para conseguir y regalarles la consola a sus compañeros del Milan, que le agradecieron por Instagram. 

🔥⚽CRACK EN TODO⚽🔥 https://t.co/jRG7HRkoq8",2020-11-19 23:46:02,Manizales,"Manizales, Colombia",1329571669283893249,https://twitter.com/i/web/status/1329571669283893249
Dios os bendiga sigo ofreciendo mis artesanías con sentido social para tratamiento enfermedad huerfana neurodegenerativa. Al comprarmen me dan alegria en mi navidad y la de mi madre Whatsapp 3104937745 https://t.co/Eyzuy8bBPT,2020-11-19 23:20:44,Manizales,"Pereira, Colombia",1329565300937863168,https://twitter.com/i/web/status/1329565300937863168
“Eterna Navidad: Celebremos” https://t.co/2ydk3o9ihY,2020-11-19 22:24:03,Manizales,"Pereira, Colombia",1329551034478436353,https://twitter.com/i/web/status/1329551034478436353
"Además estoy comiendo bocha de salmón, atún, cerdo y no pago por una comida desde hace un mes, a menos que realmente se me antoje algo tipo pizza o pasta.
Todo sin lavar una copa. Un saludo a los kumpas que en navidad van a tener que reemplazar hasta el mantecol con polenta.",2020-11-19 22:01:46,Manizales,Dinamarca,1329545427021148169,https://twitter.com/i/web/status/1329545427021148169
Un panite que me invite a armar un árbol de navidad puuuuesss,2020-11-19 21:58:40,Manizales,"Pereira, Colombia",1329544647547478019,https://twitter.com/i/web/status/1329544647547478019
Lo que mas me gusta de navidad es preparar todo lo que le voy a regalar a mi familia con la ayuda de dios🤞💪🏻💆🏻‍♀️,2020-11-19 21:43:34,Manizales,"Manizales, Colombia",1329540847881383938,https://twitter.com/i/web/status/1329540847881383938
"La. Verdad lo que les hace falta a sus árbolitos de navidad son bolitas navideñas en mdf 😍

Miren  como quedan

Pedidos 3222096777 ( no llamadas) https://t.co/iBZ5xUxKAZ",2020-11-19 20:55:52,Manizales,"Ibagué, Colombia",1329528844953546759,https://twitter.com/i/web/status/1329528844953546759
"Le iba a poner bolitas de Mickey Mouse al árbol, pero me acordé que eso no tiene nada que ver con navidad. 🥺",2020-11-19 20:49:28,Manizales,"Manizales, Colombia",1329527233795530754,https://twitter.com/i/web/status/1329527233795530754
"@GodColombiano, para esta navidad quiero una novia asi https://t.co/3lpRMktENY",2020-11-19 20:19:20,Manizales,"Manizales, Colombia",1329519649856352258,https://twitter.com/i/web/status/1329519649856352258
"@1014Robin @spineda69 Arts. 7, 8, 16, 18, 19 y 70 de la Constitución, entre otros. Yo sé que si por usted fuera, haría celebrar navidad con una misa campal oficial diaria; pero entonces los no católicos reclamarían y usted invocaría lo que ahora yo para que respeten mis costumbres.",2020-11-19 19:54:55,Manizales,"Manizales, Colombia",1329513503657431040,https://twitter.com/i/web/status/1329513503657431040
@vanguardiacom Los políticos felices con esta noticia. Les llegó la plata para navidad.,2020-11-19 19:43:29,Manizales,"Pereira, Colombia",1329510629120618499,https://twitter.com/i/web/status/1329510629120618499
"#Región | Este año la Empresa de Energía del Quindío, le entrega su mensaje de Feliz Navidad a los visitantes al parque de Los Fundadores de Armenia y otros motivos que invitan a jugar, soñar y compartir en tiempos de dificultades.https://t.co/wIvoJXWtEG",2020-11-19 19:40:03,Manizales,"Armenia, Colombia",1329509764632555524,https://twitter.com/i/web/status/1329509764632555524
@alvpaez no hay navidad sin baltasar,2020-11-19 19:04:23,Manizales,La ruina,1329500789082124293,https://twitter.com/i/web/status/1329500789082124293
@QuinteroCalle Que los paisas no confundan a su Majestad el Diablo del Carnaval de Riosucio con Krampus que se lleva a los niños malos en Navidad https://t.co/0ZlaRdedvY,2020-11-19 19:00:03,Manizales,Manizales,1329499699599073280,https://twitter.com/i/web/status/1329499699599073280
Que los paisas no confundan a su Majestad el Diablo del Carnaval de Riosucio con Krampus que se lleva a los niños malos en Navidad https://t.co/4ALwsl8aOA,2020-11-19 18:57:30,Manizales,Manizales,1329499056574521345,https://twitter.com/i/web/status/1329499056574521345
No entiendo por qué a estas alturas de noviembre no he comido oreo de navidad.,2020-11-19 18:50:48,Manizales,"Manizales, Colombia",1329497368530726914,https://twitter.com/i/web/status/1329497368530726914
"Camibusos BuenaMar en Navidad con Corazón Oporto #cartago #cartagovalledelcauca #cartagovalle #moda #ansermavalle #alcalavalle en Cartago, Valle del Cauca https://t.co/iFhimyvNbp",2020-11-19 18:41:31,Manizales,"Cartago, Colombia",1329495034891218950,https://twitter.com/i/web/status/1329495034891218950
Tan linda navidad y tu tan fea 🤣😂,2020-11-19 18:20:59,Manizales,"Armenia, Colombia",1329489865768128513,https://twitter.com/i/web/status/1329489865768128513
@QuinteroCalle Solo la mierda zurda y un sorete como ud @QuinteroCalle  puede generar semejante polémica por la navidad. Infección social!,2020-11-19 17:50:09,Manizales,"Armenia, Colombia",1329482106863554564,https://twitter.com/i/web/status/1329482106863554564
"Mi mamá: no se vistan tan temprano para navidad
Yo a las 5 de la tarde: https://t.co/HcE4SQCP4o",2020-11-19 17:33:12,Manizales,"Ibagué, Colombia",1329477839746441217,https://twitter.com/i/web/status/1329477839746441217
Para ustedes cuáles son las mejores galletas de navidad que estoy que me comooooooo,2020-11-19 17:25:51,Manizales,Armenia-Quindío,1329475992675635202,https://twitter.com/i/web/status/1329475992675635202
@FranzTrivino Los periodistas les da miedo informar la verdad porque quizás no los sigan jajaja en fin ya dicen que sale Queiroz no en fin esto va a dar para mucho hasta para las novenas de navidad 😅🤣😂,2020-11-19 17:23:32,Manizales,"Manizales, Colombia",1329475407998021635,https://twitter.com/i/web/status/1329475407998021635
¿Quieren un árbol de gatos para navidad? mi papá se los hace (gatos no incluidos) whatsapp 320 7297165 https://t.co/yagOACd9Vs,2020-11-19 17:20:27,Manizales,Manizales Colombia,1329474630508273666,https://twitter.com/i/web/status/1329474630508273666
Mor todavía estamos a tiempo de pasar navidad junticos.🥺,2020-11-19 17:02:34,Manizales,"Armenia, Colombia",1329470130263379969,https://twitter.com/i/web/status/1329470130263379969
"#ElDato | Para el armado, montaje e instalación de nuestra estrategia de navidad generamos 60 empleos locales formales, de los cuales 32 son madres cabeza de hogar, 16 personas de familias con un integrante en condición de discapacidad y 12 Personas del sector de la metalistería.",2020-11-19 17:00:01,Manizales,"Armenia, Quindío (Colombia)",1329469488371277826,https://twitter.com/i/web/status/1329469488371277826
Ya estamos modo navidad 🎄🥰. https://t.co/rLBUUeNZLL,2020-11-19 16:58:29,Manizales,"Manizales, Colombia",1329469102696640512,https://twitter.com/i/web/status/1329469102696640512
@quillerocurramb @MisterIntruso Q belleza la navidad 🎄🙄,2020-11-19 16:42:14,Manizales,"Pereira, Colombia",1329465017100603397,https://twitter.com/i/web/status/1329465017100603397
¡La Navidad llegó a Parque Arboleda Centro Comercial! https://t.co/KJdDTXcd5u,2020-11-19 16:16:03,Manizales,"Pereira, Colombia",1329458424241909760,https://twitter.com/i/web/status/1329458424241909760
"@QuinteroCalle Navidad es una época de alegría, hay muchas otras formas de conmemorar las fiestas nacionales, no es necesario hacer algo que ofenda los sentimientos religiosos de las personas",2020-11-19 16:11:26,Manizales,Manizales,1329457263120158724,https://twitter.com/i/web/status/1329457263120158724
"@sergioheld @anfelo23 @QuinteroCalle Sabe por qué, cuándo y cómo se originó la tradición de la navidad? Creo que, ni ha buscado, se hubiera ahorrado ese twit y el ridículo que hace.",2020-11-19 15:27:41,Manizales,Pereira!,1329446253709717504,https://twitter.com/i/web/status/1329446253709717504
"@QuinteroCalle Yo pienso que el diablo si tiene que ver mucho con la navidad, y ya me dio tristeza recordar que no va a haber carnaval del diablo este 2021",2020-11-19 15:00:00,Manizales,Pereira,1329439287490859010,https://twitter.com/i/web/status/1329439287490859010
"💚💳Cotrasena se adelanta a la navidad. Realiza tus compras navideñas con tu cupo rotativo; si no lo tienes, solicítalo ya.💳💚 
Vienen muchas sorpresas.🎄 https://t.co/9zlgj2KAXb",2020-11-19 14:28:20,Manizales,Pereira - Risaralda,1329431319512829952,https://twitter.com/i/web/status/1329431319512829952
Fav si vienes a ayudarme a armar el arbolito de navidad.,2020-11-19 14:12:41,Manizales,"Armenia, Colombia",1329427379446571008,https://twitter.com/i/web/status/1329427379446571008
"📀📻🎙💿🎄Llegó la Navidad a Caracol Radio Manizales. Sin duda alguna, la mejor época del año💿🎙📻📀🎇 https://t.co/jnrmvhsIlw",2020-11-19 13:49:56,Manizales,"Manizales, Colombia",1329421655446315014,https://twitter.com/i/web/status/1329421655446315014
"@razonmasfe Quieren reemplazar toda la tradición católica de los colombianos con su opuesto, el satanismo, la brujería y el irrespeto a la Fe. NAVIDAD es el advenimiento del Hijo d Dios y con ella el anuncio del Rey de reyes, a pesar d quienes equivocadamente creen q le matarán d nuevo",2020-11-19 13:18:53,Manizales,"Pereira, Colombia",1329413840342306816,https://twitter.com/i/web/status/1329413840342306816
Solo quiero prender el arbolito de navidad y hacer buñuelos 🥺,2020-11-19 13:16:11,Manizales,"Manizales, Colombia",1329413161884192771,https://twitter.com/i/web/status/1329413161884192771
"Niega el Alcalde de Medellín que la NAVIDAD hace referencia a la venida del hijo de Dios, a la celebración que hacemos de ella y al vínculo mayoritario de Colombia a esa Verdad. Destacar los ídolos y deidades anticatolicas en franca promoción carnavelezca es irrespeto a la Fe",2020-11-19 13:12:06,Manizales,"Pereira, Colombia",1329412133881253889,https://twitter.com/i/web/status/1329412133881253889
@BluRadioCo Se le adelantó la Navidad a 40 funcionarios públicos de la diana o la policía,2020-11-19 13:09:15,Manizales,pereira,1329411415438979072,https://twitter.com/i/web/status/1329411415438979072
"Si ya estás armando la navidad en tu casa, recuerda revisar bien tus luces navideñas, ya que si tienen algún daño en el cableado o bombillos defectuosos esto podría causar un accidente en tu hogar.",2020-11-19 13:00:00,Manizales,"Armenia, Quindío (Colombia)",1329409088590020609,https://twitter.com/i/web/status/1329409088590020609
https://t.co/wQPzqH5bxu a mi esta navidad paisa cristiana es la que más me gusta 💃🏻,2020-11-19 11:43:34,Manizales,"Manizales, Colombia",1329389851079274496,https://twitter.com/i/web/status/1329389851079274496
"ángel tenía razón, estoy re sintiendo vibes de navidad^^",2020-11-19 08:41:04,Manizales,la ruina,1329343925627318274,https://twitter.com/i/web/status/1329343925627318274
Mi familia no quería navidad así que la metí toda a mi cuarto ♡ https://t.co/c7d1qiQMSq,2020-11-19 04:39:57,Manizales,"Armenia, Quindío",1329283246610403330,https://twitter.com/i/web/status/1329283246610403330
Two queens un a king sized bed de Girl in red es la única canción de navidad que pondré en diciembre.,2020-11-19 04:14:35,Manizales,jardín,1329276860937760768,https://twitter.com/i/web/status/1329276860937760768
"A cuidarnos en esta navidad.Vamos a encarar el momento más difícil del año.“La cuesta de enero va a ser  tremenda porque será con nuestros familiares directamente”señala la virologa M.del Val,quien dice que diciembre y enero son los peores meses para enfermedades respiratorias.",2020-11-19 04:06:35,Manizales,Manizales,1329274851362803715,https://twitter.com/i/web/status/1329274851362803715
Quedo tan chimba mi casita con la navidad.😍😍😍🥳,2020-11-19 03:28:32,Manizales,"Montenegro, Colombia",1329265273732542465,https://twitter.com/i/web/status/1329265273732542465
"Mi mamá preguntándome si voy a traer novia esta navidad hahahahaha, solo me llevó a recordar hace 6 años cuando salí del closet cómo reacciono y ahora así ❤️❤️❤️ es bien lindo eso",2020-11-19 03:14:14,Manizales,"Armenia, Colombia",1329261674692546561,https://twitter.com/i/web/status/1329261674692546561
Los arbolitos de Navidad no tienen flores pero ustedes no están listos para esta conversación.,2020-11-19 03:09:48,Manizales,"Pereira, Colombia.",1329260559817207811,https://twitter.com/i/web/status/1329260559817207811
Celebremos navidad viendo Wonder Woman 😍 https://t.co/UMe9TUhANS,2020-11-19 03:05:47,Manizales,Cartago,1329259548876693504,https://twitter.com/i/web/status/1329259548876693504
"@angelica0830 Jum, yo digo películas de Navidad pero nada Jum.",2020-11-19 02:33:16,Manizales,"Pereira, Risaralda",1329251365865086979,https://twitter.com/i/web/status/1329251365865086979
Pobres pelados que se robaron los adornos navideños. VAMOS TODOS A DAÑAR ESOS HIJUEPUTAS UN AÑO DE OLVIDO TOTAL DEL GOBIERNO Y AHORA NOS QUIEREN VENDER LA FALSA FELICIDAD DE LA NAVIDAD LA CHIMBA.,2020-11-19 02:03:38,Manizales,Armenia,1329243908593897472,https://twitter.com/i/web/status/1329243908593897472
Esta navidad solo pido que se le estallen un par de papeletas en las manos a los mugrosos que compran pólvora 🙏🏽,2020-11-19 01:49:20,Manizales,"Pereira, Colombia",1329240309713301509,https://twitter.com/i/web/status/1329240309713301509
"No entiendo por qué se indignan con esa medida... Libertad de expresión si, pero la Navidad es Navidad y sin ese tipo de representaciones que atentan contra la religión católica! https://t.co/DrkdKf8zAB",2020-11-19 01:32:12,Manizales,"Manizales, Colombia",1329235995984883728,https://twitter.com/i/web/status/1329235995984883728
"Mi crush : Me encantan los árboles de navidad.
Yo: https://t.co/dFmXAe1uBb",2020-11-18 23:36:21,Manizales,"Pereira, Colombia",1329206844821270530,https://twitter.com/i/web/status/1329206844821270530
