tweet,date,city,user_location,id,link
"Amigos míos les presento mi árbol de navidad, terminé casi a media noche, Con 200 luces compradas en todo a 5 mil (no duran sino una navidad). https://t.co/Xeyi7Zcukk",2020-11-17 15:04:45,Bucaramanga,"Floridablanca, Colombia",1328715707740250112,https://twitter.com/i/web/status/1328715707740250112
"@julian_lopera2 @EPMestamosahi @AlcaldiadeMed @QuinteroCalle Ese hp de pintura, confunde la navidad con noche de brujas.",2020-11-17 14:35:47,Bucaramanga,"Bucaramanga, Colombia",1328708415313620992,https://twitter.com/i/web/status/1328708415313620992
La navidad y la nostalgia siempre vienen agarraditas de la mano.,2020-11-20 05:13:03,Cartagena,Cartagena.,1329653962329497600,https://twitter.com/i/web/status/1329653962329497600
Quien mas ama la navidad 🎄❤️🎀✨👁️👄👁️ https://t.co/MUSCxUmHgL,2020-11-20 04:49:05,Cartagena,"Barranquilla, Colombia",1329647931545300992,https://twitter.com/i/web/status/1329647931545300992
Y si te pido de regalito de navidad?🤔,2020-11-20 04:48:16,Cartagena,"Barranquilla, Colombia",1329647726083104769,https://twitter.com/i/web/status/1329647726083104769
En vez de criticar porque mejor no ayudan a las familias que que ya no tienen donde vivir ni donde pasar navidad ni año nuevo en #SanAndresyProvidencia,2020-11-20 04:40:23,Cartagena,Cartagena,1329645742890364929,https://twitter.com/i/web/status/1329645742890364929
Nunca iré a pasar navidad con nadie😭😭😭😭😭 https://t.co/7n8db2FzH8,2020-11-20 04:35:44,Cartagena,"Barranquilla, Colombia",1329644572696326146,https://twitter.com/i/web/status/1329644572696326146
"Al principio  del vídeo ""si veo a tu mamá"" de Bad Bunny muestran a un man que en navidad tiene ganas de matarse y llega un pelaito y lo salva llevándolo a escuchar a Benito. Fue una predicción.

😔 escuchen ba boni y no se maten😔",2020-11-20 04:34:15,Cartagena,Macondo,1329644198241427457,https://twitter.com/i/web/status/1329644198241427457
"Top películas que odio: 
1. De perros que hablan
2. De gatos que hablan
3. De perros y gatos que hablan y que están en contra
4. De navidad",2020-11-20 04:31:08,Cartagena,"Barranquilla, Colombia",1329643415353561089,https://twitter.com/i/web/status/1329643415353561089
😍Que quiere  para navidad? Yo si decía!😂🤣😂 https://t.co/YQmow3tdBQ,2020-11-20 04:19:35,Cartagena,Barranquilla ,1329640507434295298,https://twitter.com/i/web/status/1329640507434295298
Ame la navidad de flaky Cartagena 😍,2020-11-20 04:19:24,Cartagena,"Barranquilla, Colombia",1329640463624704000,https://twitter.com/i/web/status/1329640463624704000
"Querido papa noel, ponla debajo de mi arbol de navidad, solo te pido eso.",2020-11-20 04:08:44,Cartagena,Cartagena/Colombia,1329637777844146176,https://twitter.com/i/web/status/1329637777844146176
Recomiéndenme una película de navidad YAYAYA,2020-11-20 03:56:52,Cartagena,"Barranquilla, Colombia",1329634792229527554,https://twitter.com/i/web/status/1329634792229527554
"ENSERIO ESTAS INTENTANDO CANCELAR A UNA NIÑA, POR QUÉ NO LE GUSTABA LA COMIDA, EN SERIO, NO EVOLUCIONAMOS GENTE...... 🙄",2020-11-20 03:50:37,Cartagena,"Barranquilla, Colombia",1329633220363751427,https://twitter.com/i/web/status/1329633220363751427
Ya le dije a Santa 🎅 que te quiero a tiiii de regalo de navidad🎄🤍🥺,2020-11-20 03:50:01,Cartagena,Cartagena-Colombia,1329633068496396289,https://twitter.com/i/web/status/1329633068496396289
Ya me pintaba en otro lugar en navidad😴,2020-11-20 03:39:10,Cartagena,"Barranquilla, Colombia",1329630339287961600,https://twitter.com/i/web/status/1329630339287961600
Quiero como mil galletas de oreo de navidad 🤤❤️,2020-11-20 03:36:25,Cartagena,"Barranquilla, Colombia",1329629646795788289,https://twitter.com/i/web/status/1329629646795788289
"Hoy me dijeron algo acerca de mi salud que me ha tenido preocupada e ida todo el día 🥺 y aún así no dejo de pensar en que le voy a dar a mi hijo y mis sobrinos de navidad, creo que me estoy estresando más de lo que debo 🤦🏻‍♀️",2020-11-20 03:33:28,Cartagena,"Barranquilla, Colombia",1329628903795806209,https://twitter.com/i/web/status/1329628903795806209
¡No puedo del cansancio! Lo bueno de todo esto es que ya casi terminan los detalles del apto y yo de arreglarlo y me ilusiona más que cuando todo eso pase colocaré mi navidad cómo  quiero🤩😍,2020-11-20 03:24:01,Cartagena,,1329626526472687617,https://twitter.com/i/web/status/1329626526472687617
"Gilberto Santa Rosa, Alejandro Sanz, Tito Nieves y Pimpinela anuncian conciertos virtuales para despedir el 2020 con alegría. 🎄🎙️
https://t.co/7KLlfgPAA0",2020-11-20 03:00:00,Cartagena,"Barranquilla, Colombia",1329620482015031297,https://twitter.com/i/web/status/1329620482015031297
Quiero un gorrito de navidad,2020-11-20 02:53:05,Cartagena,"Barranquilla, Colombia",1329618741701857282,https://twitter.com/i/web/status/1329618741701857282
"Gracias a @vodkaytequilaa haré el práctico de cardio con gorro de navidad, guarden el tweet.",2020-11-20 02:37:16,Cartagena,"Barranquilla, Colombia",1329614761487687681,https://twitter.com/i/web/status/1329614761487687681
@DanielSamperO @MegustaleerCo @Escuelade_YT EXIJO QUE ESTA CANCIÓN SE SUBABYA MISMOS A LAS PLATAFORMAS DE STREAMING PARA COLOCARLA EN LA PLAYLIST DE NAVIDAD!!!,2020-11-20 02:31:07,Cartagena,Barranquilla-Colombia,1329613214108307456,https://twitter.com/i/web/status/1329613214108307456
@mazuerop03 Te recomiendo Operación Feliz Navidad y Amor de Calendario,2020-11-20 02:29:53,Cartagena,"Cartagena, Colombia",1329612901821403137,https://twitter.com/i/web/status/1329612901821403137
"Presumiendo el árbol de navidad que hizo mi mamita. 🎄🎅
Viene la mejor época del año❤️ https://t.co/yEcdZ9u6cW",2020-11-20 02:23:03,Cartagena,"Barranquilla, Colombia",1329611180495818753,https://twitter.com/i/web/status/1329611180495818753
"De navidad quiero que el doctor Carlos Ramos me opere, oíste Papá Noel 🎅🏼 por si tienes Twitter.",2020-11-20 02:21:37,Cartagena,Barraquilla,1329610823136804865,https://twitter.com/i/web/status/1329610823136804865
Mi época favorita es la navidad❤️🎄,2020-11-20 02:00:43,Cartagena,"Barranquilla, Colombia",1329605561176952832,https://twitter.com/i/web/status/1329605561176952832
Faltan 5 sábados para navidad y estoy entre colgar las luces o colgarme yo.,2020-11-20 01:59:16,Cartagena,"Cartagena, Colombia",1329605196222263296,https://twitter.com/i/web/status/1329605196222263296
Cuando tienes hijos la navidad es mucho más especial ❤,2020-11-20 01:48:06,Cartagena,"Cartagena, Colombia",1329602385916911616,https://twitter.com/i/web/status/1329602385916911616
Nadie se vea Navidad en Africa van a llorar😍😭🐘❤️,2020-11-20 01:46:43,Cartagena,Colombia,1329602037521272833,https://twitter.com/i/web/status/1329602037521272833
En navidad regala deporte ⛹️#pasiondegavilanes,2020-11-20 01:46:13,Cartagena,,1329601911436304384,https://twitter.com/i/web/status/1329601911436304384
GALLETAS NAVIDEÑAS con #royalicing o grasa 🎄 Decoraciones Navideñas https://t.co/mzlm8zbnyv a través de @YouTube #Navidad #navidadfalabella,2020-11-20 01:44:11,Cartagena,Barranquilla Colombia,1329601400939147265,https://twitter.com/i/web/status/1329601400939147265
Don Omar – Navidad Pa La Calle https://t.co/NNE7DGI5x3,2020-11-20 01:32:46,Cartagena,Colombia - Cartagena,1329598529938092041,https://twitter.com/i/web/status/1329598529938092041
"que pide uno a los 25 de navidad? como q bro necesito estabilidad emocional, un ps5 y una casa https://t.co/4baADDe6ci",2020-11-20 01:18:13,Cartagena,"Barranquilla, Colombia",1329594866951712768,https://twitter.com/i/web/status/1329594866951712768
Las oreo de navidad me permiten sobrevivir todo el año.,2020-11-20 01:15:38,Cartagena,"Barranquilla, Colombia",1329594216838729728,https://twitter.com/i/web/status/1329594216838729728
"Ya quiero tener mi propia casa para cuando sea Navidad, decorarla hasta el ultimo rincón😍",2020-11-20 01:14:08,Cartagena,"Barranquilla, Colombia",1329593837426184196,https://twitter.com/i/web/status/1329593837426184196
"Artesanías del Atlántico presentó su nueva colección de Navidad ""Guardianes de luz"" 🎄  Colección que expone el talento de nuestros artesanos para llenar de colores los hogares de los atlanticenses. ✨ 

#ArtesaníasDelAtlántico https://t.co/Ow3LBwU5ou",2020-11-20 01:02:32,Cartagena,"Barranquilla, Colombia",1329590921294393350,https://twitter.com/i/web/status/1329590921294393350
"ese trend de fotos de perfil de whatsapp no me gusta, tengo a panda con un gorrito de navidad 🧍🏻‍♀️",2020-11-20 01:01:49,Cartagena,"Barranquilla, Colombia",1329590741342035973,https://twitter.com/i/web/status/1329590741342035973
"En #ArtesaníasDelAtlántico hoy encendimos la Navidad y presentamos una colección que llega para iluminar los hogares del departamento, #GuardianesDeLuz, una serie de piezas decorativas que reflejan el espíritu creativo, la esperanza y la fortaleza de los artesanos del Atlántico. https://t.co/6IFAZAcxpN",2020-11-20 00:59:05,Cartagena,"Barranquilla, Colombia",1329590049495773185,https://twitter.com/i/web/status/1329590049495773185
"Yo: vamos lento ok? 

El: si, perfecto así debe ser 

Yo: Quieres pasar navidad conmigo???????",2020-11-20 00:54:40,Cartagena,Barranquilla ,1329588938554662917,https://twitter.com/i/web/status/1329588938554662917
Hoy salí a comprar un silicone case color verde navidad y termine comprando el del  Grinch.,2020-11-20 00:50:08,Cartagena,"Cartagena, Colombia",1329587798840659972,https://twitter.com/i/web/status/1329587798840659972
Mk faltan 35 días para navidad 🤯🥰,2020-11-20 00:39:36,Cartagena,Cartagena-colombia,1329585149042958337,https://twitter.com/i/web/status/1329585149042958337
"MIS SOBRINOS
NAVIDAD 2020 https://t.co/M4cysRecyG",2020-11-20 00:37:56,Cartagena,"Barranquilla,colombia ",1329584730237448195,https://twitter.com/i/web/status/1329584730237448195
"Eres como una tarjeta de navidad, que dice cosas muy lindas pero no sirven para nada...",2020-11-20 00:35:14,Cartagena,"Barranquilla, Colombia",1329584048906383360,https://twitter.com/i/web/status/1329584048906383360
Ahora si podemos empezar a ver películas de navidad!,2020-11-20 00:31:27,Cartagena,"Cartagena, Colombia",1329583098367971329,https://twitter.com/i/web/status/1329583098367971329
Ya se acerca la navidad 🎅🏻... Si necesitan un ángel me avisan!!!!!!!,2020-11-20 00:22:32,Cartagena,"Baranoa, Colombia",1329580852959916034,https://twitter.com/i/web/status/1329580852959916034
@ziliava @Ldmoya21 ya sabes que dar en navidad,2020-11-20 00:21:59,Cartagena,Barranquilla,1329580713205772289,https://twitter.com/i/web/status/1329580713205772289
"Mi regalo de navidad de mi para mi, fue cancelar una de mis tarjetas #goals",2020-11-20 00:12:43,Cartagena,,1329578384196833282,https://twitter.com/i/web/status/1329578384196833282
Me gusta la Navidad porque es cuando puedo recibir un abrazo.,2020-11-20 00:10:04,Cartagena,Barranquilla,1329577715721265153,https://twitter.com/i/web/status/1329577715721265153
@ejbaesth Siiiii.. mi navidad se adelantó,2020-11-19 23:42:33,Cartagena,"Cartagena, Bolívar",1329570789541224450,https://twitter.com/i/web/status/1329570789541224450
@ChrisDaes @_VentanaAlMundo Me gustaría más  tener empleo la Navidad sólo dura un mes,2020-11-19 23:36:11,Cartagena,"Barranquilla, Colombia",1329569190743830529,https://twitter.com/i/web/status/1329569190743830529
"@AlargueCaracol Menos mal redacto, porque donde hablé, llega navidad y aún estáriamos escuchando su aclaración 🤭",2020-11-19 23:31:06,Cartagena,"Barranquilla, Colombia",1329567909807616001,https://twitter.com/i/web/status/1329567909807616001
@diegonoticia Se le arregló la navidad.,2020-11-19 23:11:13,Cartagena,"Cartagena, Colombia",1329562906338406401,https://twitter.com/i/web/status/1329562906338406401
"invitamos a que nos unamos a esta hermosa iniciativa para regalar una bonita Navidad a un Angelito. 😇🤗⭐🙏🎄🎁

¡Contamos con ustedes!💙 https://t.co/eL7jDSD3Ty",2020-11-19 23:10:12,Cartagena,"Barranquilla, Colombia",1329562650171338754,https://twitter.com/i/web/status/1329562650171338754
Esas personas que pagan para que les decoren las casas en navidad son el propio grinch en persona...,2020-11-19 23:09:38,Cartagena,"Barranquilla, Colombia",1329562509150445569,https://twitter.com/i/web/status/1329562509150445569
"Señor alcalde @QuinteroCalle es Navidad , otro día se les hará un reconocimiento a las tradiciones de carnavales ,  pero los niños quieren su Navidad como la tuvimos nosotros tradicionales alumbrados https://t.co/kfLzKnUHOJ",2020-11-19 22:55:50,Cartagena,"Barranquilla, Colombia",1329559034182176768,https://twitter.com/i/web/status/1329559034182176768
"En Paseo de la Castellana encendimos el alumbrado navideño recordando todos los buenos momentos que hemos compartido juntos, con la esperanza de que volveremos a vivirlos una vez más.

#Navidad #NavidadCastellana #PaseoDeLaCastellana #Luces #Iluminacion https://t.co/JYwkpKTenJ",2020-11-19 22:32:41,Cartagena,Cartagena de Indias,1329553209518600195,https://twitter.com/i/web/status/1329553209518600195
"Propuse mi campaña a la fundación vivac de la cuál soy miembro junto con mi sobrina que es la encargada de la fundación, apostamos a los materiales de construcción así sea 10 casas que se logren arreglar para navidad será una buena noche .",2020-11-19 22:24:18,Cartagena,"Cartagena, Colombia",1329551097887911940,https://twitter.com/i/web/status/1329551097887911940
Ah quien más le da nostalgia escuchar música de Navidad? 🥺,2020-11-19 22:18:32,Cartagena,"Barranquilla, Atlántico",1329549648919465987,https://twitter.com/i/web/status/1329549648919465987
Faltan 36 días para navidad,2020-11-19 21:59:06,Cartagena,Barranquilla,1329544756234432514,https://twitter.com/i/web/status/1329544756234432514
@lisetik La navidad se daña con el solo hecho de ser navidad!,2020-11-19 21:57:09,Cartagena,Cartagena - Colombia,1329544267086372866,https://twitter.com/i/web/status/1329544267086372866
@___Mr__Robot___ Quiubo pues. Su oportunidad de comprarme el regalito de navidad/cumpleaños 😎,2020-11-19 21:50:39,Cartagena,Macondo🦋,1329542628921131008,https://twitter.com/i/web/status/1329542628921131008
"@miska_muska_ 1. Puente de diciembre.
2. Llega con la Navidad y caga el 24 por la noche.",2020-11-19 21:36:23,Cartagena,Cartagena,1329539038999687170,https://twitter.com/i/web/status/1329539038999687170
"@jcomesana0 Navidad, navidad, navidad jajajajaja",2020-11-19 21:33:13,Cartagena,"Barranquilla, Colombia",1329538243759648768,https://twitter.com/i/web/status/1329538243759648768
"Alistando los pases prohibidos 🚫 pa velitas 🕯#4fiestas #Navidad 
@acerolaa_ @MarioGiraldoR @AdrianaRosado01 @LaAhuyamita https://t.co/EsAN0HatN7",2020-11-19 21:29:35,Cartagena,Barranquilla-Colombia ,1329537330886139904,https://twitter.com/i/web/status/1329537330886139904
Esta navidad será de las peores,2020-11-19 21:17:45,Cartagena,"Cartagena, Colombia",1329534352775139337,https://twitter.com/i/web/status/1329534352775139337
¿Quien le puso género a las pijamas de navidad? Pa meterle un coñazo.,2020-11-19 21:16:51,Cartagena,"Barranquilla, Colombia",1329534123480846337,https://twitter.com/i/web/status/1329534123480846337
@camiloandresar1 Ya @rosaochoa09 sabe q darte de navidad,2020-11-19 21:15:35,Cartagena,"Cartagena, Colombia",1329533807687503883,https://twitter.com/i/web/status/1329533807687503883
@lapola1967 @QuinteroCalle ¿Usted sabe cómo dónde y quiénes iniciaron la Navidad?. Señora le falta mucha historia por leer y conocer,2020-11-19 21:13:56,Cartagena,"Barranquilla, Colombia",1329533391243534336,https://twitter.com/i/web/status/1329533391243534336
"@ToqueSports @SebasCM_ regalo de bd, grado, navidad, Año Nuevo y carnavales.",2020-11-19 20:55:47,Cartagena,"Barranquilla, Colombia",1329528822241357829,https://twitter.com/i/web/status/1329528822241357829
"De navidad lo único que quiero es una wafflera, por favor y gracias.",2020-11-19 20:43:39,Cartagena,Cartagena,1329525769501089803,https://twitter.com/i/web/status/1329525769501089803
"Este año saco lo mejor de nosotros y en la #FamiliaClaro seguiremos conectando a millones de corazones en la mejor época del año, por eso sonríe y dale la bienvenida a la Navidad #MagiaYEsperanza ❄☃ conoce más aquí 👉 https://t.co/r5emJiViXx  #NavidadClaro #NavidadPower https://t.co/Midf6Vr6nf",2020-11-19 20:34:46,Cartagena,"Barranquilla, Atlántico",1329523532494094336,https://twitter.com/i/web/status/1329523532494094336
@LordVereda @Nallyluz Jajajajajaja no me veo dandole un extensor de pene a mi pareja de navidad o de cumpleaños.,2020-11-19 20:27:28,Cartagena,"Cartagena, Colombia",1329521695196139521,https://twitter.com/i/web/status/1329521695196139521
Le compré un busito de navidad bien lindo😍🤩 para ponérselo cuando se duerma,2020-11-19 20:24:47,Cartagena,"Barranquilla, Atlántico",1329521022618509323,https://twitter.com/i/web/status/1329521022618509323
"Mi mamá: Nena, cuándo te cortas el cabello otra vez. Hazlo para ahora en navidad. 
Yo: Madre, no me tienteeeees.",2020-11-19 20:05:10,Cartagena,"Barranquilla, Colombia",1329516086392393735,https://twitter.com/i/web/status/1329516086392393735
"Les adelanto la navidad a mis Bro, ya les tengo juguetes",2020-11-19 19:57:45,Cartagena,"San Jacinto, Colombia",1329514217381257222,https://twitter.com/i/web/status/1329514217381257222
"Ya yo ando enviando lo que quiero de navidad, empieza por V y se usa en las playas y piscinas.",2020-11-19 19:40:18,Cartagena,Cartagena Colombia ,1329509827974934529,https://twitter.com/i/web/status/1329509827974934529
"A mi no me preocupa no tener pareja para navidad , a mi lo que me preocupa es que no tenga plata para hacer la tomación",2020-11-19 19:28:37,Cartagena,San Juan Nepomuceno ,1329506886824169472,https://twitter.com/i/web/status/1329506886824169472
"Se acerca la navidad... Pero la ropa está embolatada, cuánt@s más están como yo 😂😂😂😂 https://t.co/pNsnaoIA6e",2020-11-19 18:59:48,Cartagena,Barranquilla,1329499634197262338,https://twitter.com/i/web/status/1329499634197262338
Se acerca la navidad taaaaan tannnnn https://t.co/snqSQL4tAR,2020-11-19 18:52:08,Cartagena,Barranquilla ,1329497703877926913,https://twitter.com/i/web/status/1329497703877926913
"The greatest showman de Navidad, mencanta para estas épocas, recomendada, los efectos muy buenos y el soundtrack 👌
8 de 10
✨✨✨✨✨✨✨✨ https://t.co/DfQGmQd39x",2020-11-19 18:51:13,Cartagena,"Barranquilla, Colombia",1329497474973769734,https://twitter.com/i/web/status/1329497474973769734
"Paciencia con mi gato y la tumbadera de las bolas del árbol de navidad 💆🏽‍♀️ 
Quién se lo aguanta en las madrugadas.",2020-11-19 18:47:43,Cartagena,"Barranquilla, Colombia",1329496594429980673,https://twitter.com/i/web/status/1329496594429980673
"Si me van a regalar algo para ésta navidad que sea una nevera, estufa, televisor y pagar la matrícula de la U, con eso ya tengo suficiente 🤭",2020-11-19 18:37:35,Cartagena,Barranquilla.,1329494044918079489,https://twitter.com/i/web/status/1329494044918079489
035 dias para navidad :),2020-11-19 18:34:08,Cartagena,"Cartagena, Colombia",1329493174595837953,https://twitter.com/i/web/status/1329493174595837953
"Hogar dulce hogar

Si amikos mi mom ya decora navidad 🎅 https://t.co/LqVwqaBQXK",2020-11-19 18:29:07,Cartagena,"Cartagena, Colombia",1329491914429755393,https://twitter.com/i/web/status/1329491914429755393
SANTA ROSA PRENDERÁ LA NAVIDAD CON CONCIERTO VIRTUAL ESTE 28 DE NOVIEMBRE https://t.co/9L8ZqHuUfX,2020-11-19 18:16:26,Cartagena,"Barranquilla, Colombia",1329488720597315584,https://twitter.com/i/web/status/1329488720597315584
"Amo ver peliculas de navidad, amor y princesas, simplemente ME  ENCANTA.",2020-11-19 18:12:03,Cartagena,"Cartagena, Colombia",1329487619089174529,https://twitter.com/i/web/status/1329487619089174529
El Corte Inglés premia a los fans del chocolate y dulces infantiles con descuentos en juguetes esta Navidad https://t.co/Xg0S41D3PL,2020-11-19 18:05:48,Cartagena,Cartagena,1329486044073517057,https://twitter.com/i/web/status/1329486044073517057
Copas personalizadas y sangría  @EstragonBQ un lindo regalo para navidad 🥰 https://t.co/0qaeLgTIkC,2020-11-19 18:00:40,Cartagena,"Barranquilla, Colombia",1329484752068472832,https://twitter.com/i/web/status/1329484752068472832
Copas personalizadas y sangría  @EstragonBQ un lindo regalo para navidad 🥰 https://t.co/R4caT5aMcM,2020-11-19 17:59:34,Cartagena,"Barranquilla, Colombia",1329484478193004545,https://twitter.com/i/web/status/1329484478193004545
"@andreacotem Nunca es temprano ni tarde. Todo momento es un buen momento para galletas de navidad, puedo carnavalear comiendo galletas de navidad jajajaja",2020-11-19 17:58:33,Cartagena,Barranquilla ,1329484221296103426,https://twitter.com/i/web/status/1329484221296103426
"#DíaSinIVA | ¿Ya tiene su lista de compras? 🎁🎅 Esto es lo que más compran los colombianos. 👇
https://t.co/cRYIXpZbjW",2020-11-19 17:40:00,Cartagena,"Barranquilla, Colombia",1329479552259792898,https://twitter.com/i/web/status/1329479552259792898
La Navidad se les adelantó a los habitantes del barrio La Sierrita https://t.co/57tTOPZ6fl vía @eltiempo,2020-11-19 17:39:47,Cartagena,"Barranquilla, Colombia",1329479495976439813,https://twitter.com/i/web/status/1329479495976439813
El mejor disco para esta época navidad 🎄 🎅⭐️🎶 https://t.co/kkKkzLdVLg,2020-11-19 17:23:37,Cartagena,"Barranquilla, Colombia",1329475428038434822,https://twitter.com/i/web/status/1329475428038434822
¿Te puedo pedir para navidad?,2020-11-19 17:22:01,Cartagena,"Barranquilla, Colombia",1329475027079720960,https://twitter.com/i/web/status/1329475027079720960
"En la casa todos están haciendo carta de navidad, me va tocar hacerla a mí también a ver si me adelantan el regalo",2020-11-19 17:20:59,Cartagena,"Barrancabermeja, Colombia",1329474768282808320,https://twitter.com/i/web/status/1329474768282808320
"Quiero que armemos juntos, el árbol de navidad y punto.",2020-11-19 17:12:50,Cartagena,Colombia ,1329472715934273539,https://twitter.com/i/web/status/1329472715934273539
"@QuinteroCalle Navidad es una fiesta que de celebra la natividad del señor Jesús.
Carnaval es una fiesta pagana.",2020-11-19 17:12:14,Cartagena,Barranquilla - Colombia,1329472566701010945,https://twitter.com/i/web/status/1329472566701010945
@QuinteroCalle Hay que quemar ese adefecio...Eso no va con la navidad. Metase su hilo por donde más le parezca!,2020-11-19 17:06:51,Cartagena,"Barranquilla, Atlántico",1329471210795671552,https://twitter.com/i/web/status/1329471210795671552
¿Puedes ser mi regalo de navidad?:),2020-11-19 17:06:24,Cartagena,"Atlántico, Colombia",1329471094965891072,https://twitter.com/i/web/status/1329471094965891072
@Karkar071 @fecode Más vacío que una tienda de navidad en marzo,2020-11-19 17:05:46,Cartagena,Macondo,1329470939428483072,https://twitter.com/i/web/status/1329470939428483072
Ya pusieron la navidad? 🥰🎄,2020-11-19 17:01:01,Cartagena,Barranquilla,1329469743045234690,https://twitter.com/i/web/status/1329469743045234690
Definitivamente soy la única persona a la que no le gusta la navidad,2020-11-20 04:36:41,Cúcuta,"San Cristóbal, Venezuela",1329644810400051203,https://twitter.com/i/web/status/1329644810400051203
#Entretenimiento | Morat protagonizará concierto de Navidad https://t.co/uX3uZr4xwe https://t.co/Q3819Hxq9W,2020-11-20 02:20:03,Cúcuta,"Cúcuta, Colombia",1329610426288644096,https://twitter.com/i/web/status/1329610426288644096
"EN MEDELLÍN ""LA MAGIA DE COLOMBIA ILUMINA LA NAVIDAD"" https://t.co/1mIf2woHms vía @LaVozDelNorteAM",2020-11-20 01:38:20,Cúcuta,"Cúcuta, Colombia",1329599930168713216,https://twitter.com/i/web/status/1329599930168713216
Si no sabes que regalarme de navidad soy talla 500mil pesos.,2020-11-20 00:50:08,Cúcuta,"Bogotá, D.C., Colombia",1329587797821419521,https://twitter.com/i/web/status/1329587797821419521
"No tenía ganas de colocar navidad, pero está navidad tenemos una visita muy especial💙",2020-11-19 23:57:00,Cúcuta,Tachira-Venezuela,1329574428091568128,https://twitter.com/i/web/status/1329574428091568128
MultiMax Valencia da inicio a la Navidad con más de 5 mil metros cuadrados https://t.co/gdCMXFjTnY #TáchiraNews #Multimax #Valencia #Navidad #19Nov https://t.co/VB0zJ0Vrlt,2020-11-19 23:25:02,Cúcuta,Táchira,1329566383215161348,https://twitter.com/i/web/status/1329566383215161348
"Hoy la felicidad la reflejamos con nuestra mirada.
.
Por tu bienestar y el de todos disfruta de los escenarios de navidad 🎅sin quitarte tu tapabocas. 

En esta navidad... más unidos que nunca 🧡 https://t.co/XhMxMKpc16",2020-11-19 22:10:03,Cúcuta,"Cúcuta, Colombia",1329547514228449286,https://twitter.com/i/web/status/1329547514228449286
Alcalde..la Mayoría no queremos Celebrar navidad! Esos millones en decoración Inviértalos en Salud! 🤦🏻‍♀️,2020-11-19 20:17:06,Cúcuta,"Ocaña, Colombia",1329519088356499458,https://twitter.com/i/web/status/1329519088356499458
El año pasado dije que si tendría bebito vestiría mi navidad de azul y taraaaan! Ya veo todo hermoso para mi chiquito💙👶🏼💙,2020-11-19 19:57:55,Cúcuta,"Pamplona, Colombia",1329514259043274752,https://twitter.com/i/web/status/1329514259043274752
"Dios está siendo muy grande conmigo, tengo la mayor bendición del mundo creciendo dentro de mi y acabo de comprarle un pasaje a mi hermano después de más de 3 años sin verlo para pasar navidad conmigo, no me cabe el corazón en el pecho!",2020-11-19 19:06:40,Cúcuta,San Cristobal Venezuela ,1329501363232006146,https://twitter.com/i/web/status/1329501363232006146
